Address,Old_Address,GeoAddress,Latitude,Longitude
"168 Oak, Green  Green  ","168 Oak Green Drive, Lawrenceville","168, Oak, Norburys Landing, Middle Township, Cape May County, New Jersey, 08251, United States",39.0430946429071,-74.9291811907775
1646 first  avenue,"1646 first avenue apt 14g, New york","First Avenue, BU2, Damansara Utama, Petaling Jaya, Petaling, Selangor, 47800, Malaysia",3.1460939,101.6155006
"1638 Swamp  Road, ","1638 Old Cedar Swamp Road, Glen Head","1638, Swamp Road, Franklin, Franklin County, Vermont, 05450, United States",44.939319856223,-72.8683860150008
"163-30 Bay  Boulevard, ","163-30 Cross Bay Boulevard, Jamaica","163, Bay Boulevard, Pensacola, Escambia County, Florida, 32503, United States",30.4215195889464,-87.1843979136414
"163 125th  Street, ","163 West 125th Street, Brooklyn","163, 125th Street, Worcester County, Maryland, 21842, United States",38.4304137959184,-75.0563504897959
"161-04 86th  Street, ","161-04 86th Street, Howard Beach","161-04, 86th Street, Queens, Queens County, New York, 11414, United States",40.65468625,-73.8457762
"161 6  street, ","161 north 6 street, Brooklyn","161, 6 Street, Thorhild, Thorhild County, Alberta, T0A 3J0, Canada",54.1579945415094,-113.132459669811
160 160  st,"160 st Bet. Broadway & Amsterdam, Ny","160 Street, Guildford, Surrey, British Columbia, V4N 5L2, Canada",49.1870378,-122.7786183
16 South  Street,"16 South Street No 1630, Litchfield","みずほ銀行, 外堀通り, 新橋, 西新橋一丁目, 港区, 東京都, 105-0004, 日本",35.6681703,139.7554345
16 ARCADIAN  WAY,"16 ARCADIAN WAY  C-1, PARAMUS","16, Arcadian Way, Ashleyville, Charleston, Charleston County, South Carolina, 29407, United States",32.7870455715792,-79.9811187855787
16 52nd  Street,"16 East 52nd Street Suite, New York","16, 52nd Street, Gulfport, Harrison County, Mississippi, 39507, United States",30.420296,-89.0444302834615
"155 68  street, ","155 West 68 street, New York","68 Street, Westmount, Camrose, Alberta, T4V 4T1, Canada",53.0121556,-112.8583722
"1542 32  street, ","1542 East 32 street, BROOKLYN","32 Street, القوز, دبي, 166, الإمارات العربية المتحدة",25.1571449,55.2737682
"154 Brentwood  Road, ","154 Brentwood Road, Bay Shore","154, Brentwood Road, Suffolk County, New York, 11706, United States",40.7321756,-73.2367614590482
"152-03 135th  Avenue, ","152-03 135th Avenue, Jamaica","152-03, 135th Avenue, Queens, Queens County, New York, 11434, United States",40.66892185,-73.7838593
"15101 14th  Avenue, ","15101 14th Avenue, Flushing","14th Avenue, Johannesburg Ward 89, Johannesburg, City of Johannesburg Metropolitan Municipality, Gauteng, 2001, South Africa",-26.1454638,27.9529722
151 86th  St,"151 W 86th St 5D, NEW YORK","151, 86th Street, La Salle, Niagara Falls, Niagara County, New York, 14304, United States",43.0776605,-78.96543
"1500 Liberty, Ridge  Ridge  ","1500 Liberty Ridge Dr, Chesterbrook","1500, Lower Liberty Road, Liberty, Halifax County, Virginia, 24577, United States",36.8553141124585,-78.9568225088989
"1500 Liberty, Ridge  Ridge  ","1500 Liberty Ridge Dr, Chesterbrook","1500, Lower Liberty Road, Liberty, Halifax County, Virginia, 24577, United States",36.8553141124585,-78.9568225088989
"1500 Hazen  St, ","1500 Hazen St,, East Elmhurst","Hazen Street, Bellaire West, Houston, Harris County, Texas, 77072, United States",29.6924403,-95.570993
"150 Myrtle  Street, ","150 Myrtle Street, Brooklyn","150, Myrtle Street, Gann's, Odessa, Ector County, Texas, 79761, United States",31.8425470066502,-102.364544781457
150 Greenwich  Street,"150 Greenwich Street 15FL, New York","4 World Trade Center, 150, Greenwich Street, Financial District, Manhattan, New York County, New York, 10006, United States",40.71031865,-74.0119685650857
"150 95th  Street, ","150 95th Street, Brooklyn, NY, USA, New York","150, 95th Street, Fort Hamilton, Brooklyn, Kings County, New York, 11209, United States",40.6169084,-74.0366393367693
150 69th  Street,"150 East 69th Street Apt. 15G, New York","150, 69th Street, North Bay Terraces, San Diego, San Diego County, California, 92114, United States",32.704069,-117.049129
15 washington  ave,"15 washington ave suite 3540, Brooklyn","15, Washington Avenue, Toppenish, Yakima County, Washington, 98948, United States",46.3758597657694,-120.31094535357
15 Jones  St,"15 Jones St 4D, New York","15, Jones Street, Baneswell, Stow Hill, Newport, Gwent, Cymru / Wales, NP20, United Kingdom",51.58477225,-2.9990775
15 Cranberry  St,"15 Cranberry St Suite 502, Brooklyn","15, Cranberry Street, Brooklyn Heights, Brooklyn, Kings County, New York, 11201, United States",40.70025515,-73.9946800990196
149 Fifth  Ave,"149 Fifth Ave Floor 4, New York","Fifth Avenue, Sea Point, Cape Town, City of Cape Town, Western Cape, 8005, South Africa",-33.912131,18.3940861
"147-38 225th  Street, ","147-38 225th Street, Jamaica","225th Street, Laurelton, Queens, Queens County, New York, 11413, United States",40.6655837,-73.7522864
146 29th  Street,"146 W 29th Street Suite 6E, New York","146, 29th Street, Virginia Beach, Virginia, 23451, United States",36.8573965306122,-75.9771739183673
"14500 Mile  Road, ","14500 Twelve Mile Road, Warren","Mile Road, Kalkaska, Kalkaska Township, Kalkaska County, Michigan, United States",44.7427877,-85.1751271
"144-15 Charter  Road, ","144-15 Charter Road, Jamaica","144-15, Charter Road, Parkway Village, Queens, Queens County, New York, 11435, United States",40.7172028,-73.816329857432
143   terrace,"143 laurel  terrace   Apt2k new york, New york","143 Terrace, Levy County, Florida, 32668, United States",29.28959,-82.5331
"141-03 Lakewood  Avenue, ","141-03 Lakewood Avenue, Jamaica","141-03, Lakewood Avenue, Queens, Queens County, New York, 11435, United States",40.6877354,-73.8051979
"141 Clove  Road, ","141 Clove Road, Montague Township","141, Clove Road, Hyndsville, Town of Seward, Schoharie County, New York, 12043, United States",42.6848585139072,-74.562331945899
"14-30 Edge  Drive, ","14-30 Waters Edge Drive, Flushing","14, Edge Drive, Murphy Hills, Newton County, Georgia, 30054, United States",33.6386331809158,-83.8659675316395
"14 Kendrick  Ln, ","14 Kendrick Ln, Dix Hills","14, Kendrick Lane, Barlows Landing, Bourne, Barnstable County, Massachusetts, 02559, United States",41.6935097,-70.6244088621861
"1364 Clifton  Road, ","1364 Clifton Road, Atlanta, GA, USA, Atlanta","1364, Clifton Road, Clifton, Miami Township, Greene County, Ohio, 45385, United States",39.7713677466549,-83.8746825523546
1361 Madison  Avenue,"1361 Madison Avenue #7A, New York","1361, Madison Avenue, Madison, Madison County, Illinois, 62060, United States",38.6909560816327,-90.1551743469388
1361 Madison  Avenue,"1361 Madison Avenue #7A, New York","1361, Madison Avenue, Madison, Madison County, Illinois, 62060, United States",38.6909560816327,-90.1551743469388
"1360 Kania  Road, ","1360 Kania Road, Amsterdam","1360, Kania Road, Town of Galway, Saratoga County, New York, 12010, United States",42.9927965,-74.0763140078125
136 Madison  Avenue,"136 Madison Avenue Floor 17, New York","136, Madison Avenue, The Metta Lands, Madison, Madison County, Alabama, 35758, United States",34.7145923723207,-86.7382592192823
"136 22  St, ","136 W 22 St, New York","22, Mill Road, Woodstock, Lot 6, Prince County, Prince Edward Island, C0B 1E0, Canada",46.736627,-64.173402
134 26th  Street,"134 W 26th Street Suite 11st40, New York","134, 26th Street, Trowbridge Township, Allegan County, Michigan, 49010, United States",42.4298475714286,-85.7978007142857
"134 23  Rd, ","134 w 23 Rd, New yorl","134, Den Road, Southern Pines, Moore County, North Carolina, 28387, United States",35.1749884387755,-79.3701919591837
1325 1325  Avenue,"1325 Avenue of the Americas 10th Floo, New York","Brabant wallon, Wallonie, 1325, België / Belgique / Belgien",50.6879311,4.68490687931224
"132-17 Liberty  Avenue, ","132-17 Liberty Avenue, South Richmond Hill","132, Liberty Avenue, Port Jefferson, Suffolk County, New York, 11777, United States",40.9409587329807,-73.0665041202227
"132 Clark  Place, ","132 Odell Clark Place, New York","132, Clark Place, Midtown, Memphis, Shelby County, Tennessee, 38104, United States",35.1422127237068,-90.0091572753635
1311 Rock  Lane,"1311 Golden Rock Lane Southeast, Marietta","Rock Lane, Linn Valley, Linn County, Kansas, 66040, United States",38.374813,-94.716662
131 Varick  St,"131 Varick St Suite 1006, New York","131, Varick Street, Hudson Square, Manhattan, New York County, New York, 10013, United States",40.7253637,-74.0060408
131 Varick  St,"131 Varick St Suite 1006, New York","131, Varick Street, Hudson Square, Manhattan, New York County, New York, 10013, United States",40.7253637,-74.0060408
"1302 Burke  Avenue, ","1302 Burke Avenue, Syracuse","Burke Avenue, Springfield, Birmingham, West Midlands Combined Authority, West Midlands, England, B13, United Kingdom",52.4376281,-1.857409
"13 Midland  Drive, ","13 Midland Drive, New Hyde Park","13, Midland Drive, Lindsay, Kawartha Lakes, Central Ontario, Ontario, K9V 3Z5, Canada",44.3677985,-78.7461459
1290 1290  Avenue,"1290 Avenue Of The Americas, New Yor, New York","1290, Wellwood Avenue, Suffolk County, New York, 11704, United States",40.7331365,-73.3981457621665
1285 1285  Avenue,"1285 Avenue of the Americas Paul Weis, New York","1285, Tripp Avenue, Little Portugal, San Jose, Santa Clara County, California, 95116, United States",37.3539112,-121.8707297
"128-20 152  Avenue, ","128-20 152 Avenue, Jamaica","152 Avenue, Levy County, Florida, United States",29.3315713,-82.5186671
"127 Allenwood  Road, ","127 Allenwood Road, Great Neck","127, Allenwood Road, Great Neck, North Hempstead, Nassau County, New York, 11023, United States",40.7959704,-73.7244199941019
125 Worth  Street,"125 Worth Street Room 722, Long Island City","125, Worth Street, East Syracuse, Town of DeWitt, Onondaga County, New York, 13057, United States",43.0689882503799,-76.0844826187785
125 worth  Street,"125 worth Street Suite 51st2, New York","125, Worth Street, East Syracuse, Town of DeWitt, Onondaga County, New York, 13057, United States",43.0689882503799,-76.0844826187785
"125 Professional  Place, ","125 Professional Place, BRUSHY FORK","125, Professional Place, Greenwood, Leflore County, Mississippi, 38930, United States",33.525024385449,-90.2042450435898
"125 Professional  Place, ","125 Professional Place, BRUSHY FORK","125, Professional Place, Greenwood, Leflore County, Mississippi, 38930, United States",33.525024385449,-90.2042450435898
"125 Professional  Place, ","125 Professional Place, BRUSHY FORK","125, Professional Place, Greenwood, Leflore County, Mississippi, 38930, United States",33.525024385449,-90.2042450435898
"125 Professional  Place, ","125 Professional Place, BRUSHY FORK","125, Professional Place, Greenwood, Leflore County, Mississippi, 38930, United States",33.525024385449,-90.2042450435898
"125 Professional  Place, ","125 Professional Place, BRUSHY FORK","125, Professional Place, Greenwood, Leflore County, Mississippi, 38930, United States",33.525024385449,-90.2042450435898
125 Maiden  Lane,"125 Maiden Lane Suite 15C, New York","Water Street Plaza, 125, Maiden Lane, Financial District, Manhattan, New York County, New York, 10038, United States",40.70652745,-74.0061565583739
"125 125, Green  Green  ","125 Green Street Apt 2C, BROOKLYN","Green et Green, 56, Rue du Chevaleret, Quartier de la Gare, Paris 13e Arrondissement, Paris, Île-de-France, France métropolitaine, 75013, France",48.829411,2.3760335
"124-15 14th  Avenue, ","124-15 14th Avenue, Flushing","14th Avenue, Quellerina, Johannesburg Ward 89, Randburg, City of Johannesburg Metropolitan Municipality, Gauteng, 1715, South Africa",-26.1516866,27.9266895
1221 1221  Avenue,"1221 Avenue of the amercas, New York","The Avenue, Old Malden, Royal Borough of Kingston upon Thames, London, Surrey, Greater London, England, KT4 7EL, United Kingdom",51.37974,-0.2473391
122 42nd  Street,"122 East 42nd Street Suite 2005, New York City","122, 42nd Street, Newport Beach, Orange County, California, 92663, United States",33.6194422,-117.937332
122 25th  Street,"122 East 25th Street FL 5, NY","122, 25th Street, Ogden, Weber County, Utah, 84401, United States",41.220834011775,-111.978152888771
"120-45 84th  Avenue, ","120-45 84th Avenue, Hollis","120, 84th Avenue, Sunset Beach, Treasure Island, Pinellas County, Florida, 33706, United States",27.747292244898,-82.7596904081633
"120-15 Liberty  Ave, ","120-15 Liberty Ave, South Richmond Hill","120, Liberty Avenue, Franklin Park, Revere, Suffolk County, Massachusetts, 02151, United States",42.4418711380289,-71.0192050880286
120 70th  St,"120 W 70th St Apt 4B, New York","120, 70th Street, Virginia Beach, Virginia, 23451, United States",36.8955885102041,-75.9889696326531
"12 Warren  Lane, ","12 Warren Lane, Jericho","12, Warren Lane, Hicksville, Oyster Bay, Nassau County, New York, 11753, United States",40.7791145,-73.5418085
"12 Putnam  Ave, ","12 Putnam Ave, Jericho","12, Putnam Avenue, Prospect Heights, Brooklyn, Kings County, New York, 11238, United States",40.6826063,-73.9613632
"118-60 Springfield  Boulevard, ","118-60 Springfield Boulevard, Jamaica","118-60, Springfield Boulevard, Cambria Heights, Queens, Queens County, New York, 11411, United States",40.6930029,-73.7453101090099
117 Sullivan  Street,"117 Sullivan Street Apt 2C, New York","117, Sullivan Street, Red Hook, Brooklyn, Kings County, New York, 11231, United States",40.6781575,-74.013099971911
"1165 Burnett  Place, ","1165 Burnett Place, Bronx","Burnett Place, Powis, Kittybrewster, Aberdeen City, Scotland, AB24 4QD, United Kingdom",57.1644286,-2.1171427
"115-70 Springfield  Boulevard, ","115-70 Springfield Boulevard, Jamaica","115-70, Springfield Boulevard, Cambria Heights, Queens, Queens County, New York, 11411, United States",40.69942145,-73.7427010460937
"115-14 Rockaway  Boulevard, ","115-14 Rockaway Boulevard, Jamaica","115-14, Rockaway Boulevard, Queens, Queens County, New York, 11420, United States",40.67641215,-73.8223442976542
"115-03 145  Street, ","115-03 145 Street, Briarwood","145th Street, West 145th Street, Manhattan Community Board 9, Manhattan, New York County, New York, 10031, United States",40.8264999,-73.9504381
"115 Fairview  Road, ","115 Fairview Road, Elks ford","115, Fairview Road, Sandford, Fairview, Cheltenham, Gloucestershire, South West England, England, GL52 2EN, United Kingdom",51.90038085,-2.06702593903307
"114-53 207th  Street, ","114-53 207th Street, Jamaica","114-53, 207th Street, Bellaire, Queens, Queens County, New York, 11411, United States",40.70043565,-73.7468048402885
114 Liberty  Street,"114 Liberty Street 5th Floor, New York City","114, Liberty Street, Varick Homes, Newburgh, Orange County, New York, 12550, United States",41.4989209,-74.0107093
114 Liberty  Street,"114 Liberty Street 5th Floor, New York City","114, Liberty Street, Varick Homes, Newburgh, Orange County, New York, 12550, United States",41.4989209,-74.0107093
114 Liberty  Street,"114 Liberty Street 5th Floor, New York City","114, Liberty Street, Varick Homes, Newburgh, Orange County, New York, 12550, United States",41.4989209,-74.0107093
114 Liberty  Street,"114 Liberty Street 5th Floor, New York City","114, Liberty Street, Varick Homes, Newburgh, Orange County, New York, 12550, United States",41.4989209,-74.0107093
114 Liberty  Street,"114 Liberty Street 5th Floor, New York City","114, Liberty Street, Varick Homes, Newburgh, Orange County, New York, 12550, United States",41.4989209,-74.0107093
1128 Willoughby  Ave,"1128 Willoughby Ave Apt 3L, BROOKLYN","1128, Willoughby Avenue, Brooklyn, Kings County, New York, 11237, United States",40.7015772,-73.9251658
"1121 mercantile  lane, ","1121 mercantile lane, Largo","1121, Mercantile Lane, Lake Arbor, Prince George's County, Maryland, 20774, United States",38.9060779183673,-76.837681122449
"11201 Queens  Boulevard, ","11201 Queens Boulevard, 11375The Bronx","Queens Boulevard, Sunnyside, Queens, Queens County, New York, 11377, United States",40.7451498,-73.9334968
"112-10 175th  Street, ","112-10 175th Street, Jamaica","112-10, 175th Street, Queens, Queens County, New York, 11433, United States",40.6947204,-73.7772073
1109 Fulton  St,"1109 Fulton St Storefront, Brooklyn","Fulton Street, Fulton, Vineyard Hills, Wheeling, Ohio County, West Virginia, 26003, United States",40.0762499,-80.7098173
"110-21 73rd  road, ","110-21 73rd road, Forest hills","110-21, 73rd Road, Kew Gardens, Queens, Queens County, New York, 11375, United States",40.7185665,-73.8394802657465
110 Bank  Street,"110 Bank Street 2C, New York","Bank Street, Canary Wharf, Isle of Dogs, London Borough of Tower Hamlets, London, Greater London, England, E14 5DS, United Kingdom",51.503084,-0.0189202
110 96th  St,"110 W 96th St 8C, New York","96th Street, Ozone Park, Queens, Queens County, New York, 11417, United States",40.6778484,-73.8417984
"11 Park  Place, ","11 Park Place, New York, NY, USA, New York","11 Park Place, 18-19, Park Place, Crockherbtown, Castle, Cardiff, Cymru / Wales, CF, United Kingdom",51.4847766,-3.17541498013828
11 Park  Place,"11 Park Place 18th Floor, New York","11 Park Place, 18-19, Park Place, Crockherbtown, Castle, Cardiff, Cymru / Wales, CF, United Kingdom",51.4847766,-3.17541498013828
11 26th  St,"11 E 26th St Fl 15, New York","11, 26th Street, Trowbridge Township, Allegan County, Michigan, 49010, United States",42.4213727485592,-85.7974448196994
"108-25 62nd  Drive, ","108-25 62nd Drive, Forest Hills","Queens Community House, 108-25, 62nd Drive, Queens, Queens County, New York, 11374, United States",40.7361966,-73.8501995
"108-07 101st  Street, ","108-07 101st Street, South Richmond Hill","108, 101st Street, Stone Harbor, Cape May County, New Jersey, 08247, United States",39.0494373673469,-74.7595499795918
108 17th  Street,"108 East 17th Street #4R, New York","108, 17th Street, Wilmette, New Trier Township, Cook County, Illinois, 60091, United States",42.0693293292231,-87.7188531761432
"104-13 105th  Street, ","104-13 105th Street, Jamaica","104-13, 105th Street, Ozone Park, Queens, Queens County, New York, 11417, United States",40.68205495,-73.8357319444362
"104 29  Street, ","104 West 29 Street, BOWLING GREEN","29 Street, Ocala, Marion County, Florida, 34471, United States",29.1601674,-82.1059324
"1022 Antoinette  Drive, ","1022 Antoinette Drive, Monroe Township","Antoinette Drive, San Antonio, Bexar County, Texas, 78223, United States",29.378176,-98.463907
"102-30 66th  Road, ","102-30 66th Road, Forest Hills","66th Road, Rego Park, Queens, Queens County, New York, 11375, United States",40.7276311,-73.8546275
"102-19 Astoria  Boulevard, ","102-19 Astoria Boulevard, Flushing","Astoria Boulevard, Astoria, Queens, Queens County, New York, 11102, United States",40.7722067,-73.9309592
"102 Laurel  Ln, ","102 Laurel Ln, Sag Harbor","102, Laurel Lane, Town of Deerpark, Orange County, New York, 12746, United States",41.4646787790558,-74.6625744683688
"102 102, francis  st ,  lane, ","102 st francis lane, wenonah","102, Francis Street, Roxbury, Boston, Suffolk County, Massachusetts, 02215, United States",42.3370331428571,-71.109543122449
"1010 Northern  Boulevard, ","1010 Northern Boulevard, GREAT NCK","1010, Northern Boulevard, North Hempstead, Nassau County, New York, 11030, United States",40.78770475,-73.706418
"101 Grandview  Ave, ","101 Grandview Ave, Great Neck","101, Grandview Avenue, Grandview, White Township, Indiana County, Pennsylvania, 15701, United States",40.6152367676768,-79.1378685757576
1000 Hudson  Street,"1000 Hudson Street #21st1, Hoboken","1000, Hudson Street, Forest City, Susquehanna County, Pennsylvania, 18421, United States",41.6554174618719,-75.468590672609
"100 Manhattanville  Rd, ","100 Manhattanville Rd, Purchase","100, Manhattanville Road, Town of Harrison, Westchester County, New York, 10577, United States",41.025515889692,-73.7141182428762
100 Church  Street,"100 Church Street Suite 800, New York","100 Church Street, 100, Church Street, Tribeca, Manhattan Community Board 1, Manhattan, New York County, New York, 10013, United States",40.71328865,-74.0101247934377
100 Bogart  St,"100 Bogart St Suite 42, Brooklyn","100, Bogart Street, Brooklyn, Kings County, New York, 11206, United States",40.709049,-73.934515
"10 Hangar  Road, ","10 North Hangar Road, Jamaica","10, Hangar Road, Donahue Lake, Guysborough District Municipality, Guysborough County, Nova Scotia, Canada",45.3012220482929,-61.5125217505281
"10 Duncan  Road, ","10 Duncan Road, Lagrangeville","10, Duncan Road, Fairburn, Te Hiku Community, Far North District, Northland, 0483, New Zealand / Aotearoa",-35.0910365,173.3966319
" Wexford  Terrace, ","178/36 Wexford Terrace, Jamaica","Wexford Terrace, Terrace Heights, Queens, Queens County, New York, 11432, United States",40.71554,-73.7762692
" Washington  Street, ","26-Feb Washington Street, NYC","Washington Street, Commonwealth Avenue, Aberdeen, Allston, Boston, Suffolk County, Massachusetts, 02134, United States",42.3440492,-71.1426244
" Vernon  Boulevard, ","May-40 Vernon Boulevard, long island city","Vernon Boulevard, Queensbridge, Queens, Queens County, New York, 10044, United States",40.7565182,-73.9472123
" Verizon  Way, ","1 Verizon Way, Basking Ridge","Verizon Way, Van Dorans Mills, Bernards Township, Somerset County, New Jersey, 02794, United States",40.725639,-74.535133
" Verizon  Way, ","1 Verizon Way, Basking Ridge","Verizon Way, Van Dorans Mills, Bernards Township, Somerset County, New Jersey, 02794, United States",40.725639,-74.535133
" Verizon  Way, ","1 Verizon Way, Basking Ridge","Verizon Way, Van Dorans Mills, Bernards Township, Somerset County, New Jersey, 02794, United States",40.725639,-74.535133
" Verizon  Way, ","1 Verizon Way, Basking Ridge","Verizon Way, Van Dorans Mills, Bernards Township, Somerset County, New Jersey, 02794, United States",40.725639,-74.535133
" Verizon  Way, ","1 Verizon Way, Basking Ridge","Verizon Way, Van Dorans Mills, Bernards Township, Somerset County, New Jersey, 02794, United States",40.725639,-74.535133
" South  Avenue, ","1 South Avenue, GardenCity","South Avenue, Lameroo, Southern Mallee District Council, South Australia, 5302, Australia",-35.3305404,140.5183748
" Rosa  Drive, ","7 Rosa Drive, White Plains","Rosa Drive, Clifford, New Bedford, Bristol County, Massachusetts, 02745, United States",41.7290019,-70.9398955
" Rennaissance  Sq, ","1 Rennaissance Sq, White Plains","La Rennaissance, Sainte-Suzanne, Saint-Denis, La Réunion, 97441, France",-20.9266577,55.6029329
" Prince  rd, ","1 Prince rd, Whippany","Prince Road, Prince, Lincoln County, Nevada, 89043, United States",37.904908,-114.475295
" Old, NW,  Highway ,  St  ","R25 Old Highway 8 NW, St Paul","Středočeský kraj, Česko",50.0601579,13.8307479420999
" Northcastle  Dr, ","1 Northcastle Dr, Armonk","Northcastle Drive, Niagara Falls, Niagara Region, Golden Horseshoe, Ontario, L2H 1A7, Canada",43.1081786,-79.1327995
" Nevins  Street, ","4-Feb Nevins Street, Brooklyn","Nevins Street, Flatbush Avenue, Downtown Brooklyn, Brooklyn, Kings County, New York, 11227, United States",40.6887102,-73.9808138
" Murray  ave, ","1murray Murray ave, port washington","Murray Avenue, Slayton, Murray County, Minnesota, 56172, United States",44.003951,-95.763459
" Merrick  Rd, ","368A West Merrick Rd, East Rockaway","Merrick Road, Howard County, Nebraska, United States",41.341643,-98.286606
" Levy  Place, ","1 Gustave L. Levy Place, New York","Levy Place, YPG Residential Area, Yuma County, Arizona, United States",32.8646091,-114.4321836
" Levy  Place, ","1 Gustave L. Levy Place, New York","Levy Place, YPG Residential Area, Yuma County, Arizona, United States",32.8646091,-114.4321836
" Levy  Place, ","1 Gustave L. Levy Place, New York","Levy Place, YPG Residential Area, Yuma County, Arizona, United States",32.8646091,-114.4321836
" Lake  Drive, ","4 Old West Lake Drive, Montauk","Lake Drive, Lake County, Tennessee, 38079, United States",36.3631212,-89.433685
" Jackson  Avenue, ","Oct-51 Jackson Avenue, Long Island City","Jackson Avenue, Westchester Avenue, The Bronx, Bronx County, New York, 10459, United States",40.816519,-73.90778
" howmet  drive, ","P 701st howmet drive, Hamptonva","Howmet Drive, Copeland Industrial Park, Hampton, Virginia, 23661, United States",37.0144077,-76.3958503
" Harbour  Drive, ","3C Hudson Harbour Drive, Poughkeepsie","Harbour Drive, The Harbour, Johnston, Polk County, Iowa, 50131, United States",41.71797,-93.715993
" Hanover  Square, ","5 Hanover Square, Staten Island","Hanover Square, St. James's, Mayfair, City of Westminster, London, Greater London, England, United Kingdom",51.51390775,-0.143823908277023
" Hanover  Square, ","5 Hanover Square, Staten Island","Hanover Square, St. James's, Mayfair, City of Westminster, London, Greater London, England, United Kingdom",51.51390775,-0.143823908277023
" Hanover  Square, ","5 Hanover Square, Staten Island","Hanover Square, St. James's, Mayfair, City of Westminster, London, Greater London, England, United Kingdom",51.51390775,-0.143823908277023
" Hanover  Square, ","5 Hanover Square, Staten Island","Hanover Square, St. James's, Mayfair, City of Westminster, London, Greater London, England, United Kingdom",51.51390775,-0.143823908277023
" Hanover  Square, ","5 Hanover Square, Staten Island","Hanover Square, St. James's, Mayfair, City of Westminster, London, Greater London, England, United Kingdom",51.51390775,-0.143823908277023
" Hanover  Square, ","5 Hanover Square, Staten Island","Hanover Square, St. James's, Mayfair, City of Westminster, London, Greater London, England, United Kingdom",51.51390775,-0.143823908277023
" Gustave-Levy  Place, ","One Gustave-Levy Place, NY","Rue Gustave Lévy, Stockfeld, Strasbourg, Bas-Rhin, Grand Est, France métropolitaine, 67026, France",48.5343737,7.7717753
